{"$schemaId":"https://schemas.cp6.dev/release/build-invocation-provenance.v1","buildInvocationId":"p10-s04:fbcd21528078a04e5b53c42c5fdfebe6ffa9655f:34417259187:1","createdAtUtc":"2026-09-09T23:54:30.176Z","finalPackages":[{"finalSha256":"e838ba9c9c6e434f8c8a2bf41e9da7d931a962400435aabb2189f40628c17103","packageId":"CP6.Platform.Abstractions","preSignSha256":"bd56dbe04476035acc68141c38f10bde8e308f4e49125376095e8c0fbe9b49b2","subject":{"sha256OrDigest":"e838ba9c9c6e434f8c8a2bf41e9da7d931a962400435aabb2189f40628c17103","sourceGitSha":"fbcd21528078a04e5b53c42c5fdfebe6ffa9655f","subjectKind":"Package","subjectName":"CP6.Platform.Abstractions"}},{"finalSha256":"5dc9cee4335e69f463361afc89d36587650b896059472570753ef485787fec73","packageId":"CP6.Platform.AspNetCore","preSignSha256":"f08261153dc0879b500fb32c53483316f3337e276cb7552cb2b88b069ae8ef7b","subject":{"sha256OrDigest":"5dc9cee4335e69f463361afc89d36587650b896059472570753ef485787fec73","sourceGitSha":"fbcd21528078a04e5b53c42c5fdfebe6ffa9655f","subjectKind":"Package","subjectName":"CP6.Platform.AspNetCore"}},{"finalSha256":"84b62cad23d0ce09a4af545ac5ae73cd625fce33eb77d022740350dac0364570","packageId":"CP6.Platform.Contracts","preSignSha256":"98ecc304a7685566347e536b488f35ebefa9055fce28f92bfbcf9fbd42ad3a42","subject":{"sha256OrDigest":"84b62cad23d0ce09a4af545ac5ae73cd625fce33eb77d022740350dac0364570","sourceGitSha":"fbcd21528078a04e5b53c42c5fdfebe6ffa9655f","subjectKind":"Package","subjectName":"CP6.Platform.Contracts"}},{"finalSha256":"231a7cb3e18fd8ba9a7d60bbe01195ca7676c33b55b542a294c4a76c0fff066b","packageId":"CP6.Platform.Deployment","preSignSha256":"64ef40d2a62e98a98aa7a408220822d02cc085e0c8a34cad90ab72c8b90805ea","subject":{"sha256OrDigest":"231a7cb3e18fd8ba9a7d60bbe01195ca7676c33b55b542a294c4a76c0fff066b","sourceGitSha":"fbcd21528078a04e5b53c42c5fdfebe6ffa9655f","subjectKind":"Package","subjectName":"CP6.Platform.Deployment"}},{"finalSha256":"cc780ce1b454c62f96caa990eb2e0462563b1917e8c505b11100a4555d5b4544","packageId":"CP6.Platform.EntityFramework","preSignSha256":"8386071360f5f852f3c0db9653247fbaa12ad6b82395b1073ce2f19c1a3609db","subject":{"sha256OrDigest":"cc780ce1b454c62f96caa990eb2e0462563b1917e8c505b11100a4555d5b4544","sourceGitSha":"fbcd21528078a04e5b53c42c5fdfebe6ffa9655f","subjectKind":"Package","subjectName":"CP6.Platform.EntityFramework"}},{"finalSha256":"878994735a171194b8944c58fa919508380fa7d0707aa09176427295d0aab235","packageId":"CP6.Platform.Messaging","preSignSha256":"2e866fff59363304a332020de67181335ee98e8cd002c38fb192822344c62ecd","subject":{"sha256OrDigest":"878994735a171194b8944c58fa919508380fa7d0707aa09176427295d0aab235","sourceGitSha":"fbcd21528078a04e5b53c42c5fdfebe6ffa9655f","subjectKind":"Package","subjectName":"CP6.Platform.Messaging"}},{"finalSha256":"0b8fd3b332c837e6f1c0cbe9c312e87a671c4f119d2128768f7284d4fa26a8f1","packageId":"CP6.Platform.Release","preSignSha256":"cb7918999d09eddf21e80a932763801df9dc909105a2545c24758b0173115c2a","subject":{"sha256OrDigest":"0b8fd3b332c837e6f1c0cbe9c312e87a671c4f119d2128768f7284d4fa26a8f1","sourceGitSha":"fbcd21528078a04e5b53c42c5fdfebe6ffa9655f","subjectKind":"Package","subjectName":"CP6.Platform.Release"}}],"preSignOutputs":[{"packageId":"CP6.Platform.Abstractions","sha256":"bd56dbe04476035acc68141c38f10bde8e308f4e49125376095e8c0fbe9b49b2"},{"packageId":"CP6.Platform.AspNetCore","sha256":"f08261153dc0879b500fb32c53483316f3337e276cb7552cb2b88b069ae8ef7b"},{"packageId":"CP6.Platform.Contracts","sha256":"98ecc304a7685566347e536b488f35ebefa9055fce28f92bfbcf9fbd42ad3a42"},{"packageId":"CP6.Platform.Deployment","sha256":"64ef40d2a62e98a98aa7a408220822d02cc085e0c8a34cad90ab72c8b90805ea"},{"packageId":"CP6.Platform.EntityFramework","sha256":"8386071360f5f852f3c0db9653247fbaa12ad6b82395b1073ce2f19c1a3609db"},{"packageId":"CP6.Platform.Messaging","sha256":"2e866fff59363304a332020de67181335ee98e8cd002c38fb192822344c62ecd"},{"packageId":"CP6.Platform.Release","sha256":"cb7918999d09eddf21e80a932763801df9dc909105a2545c24758b0173115c2a"}],"sourceGitSha":"fbcd21528078a04e5b53c42c5fdfebe6ffa9655f","toolchain":{"dotnetSdk":"8.0.425","runner":"win25-vs2026"}}